{
  "captured_at": "2026-06-28T04:05:40.694478Z",
  "entity": {
    "id": "package:voicepad",
    "name": "voicepad",
    "type": "package"
  },
  "metrics": {
    "downloads_last_30_days": {
      "category": "adoption",
      "unit": "count",
      "value": 1531
    },
    "downloads_last_90_days": {
      "category": "adoption",
      "unit": "count",
      "value": 4126
    },
    "downloads_total": {
      "category": "adoption",
      "unit": "count",
      "value": 5292
    }
  },
  "schema_version": 1,
  "source": {
    "api_url": "https://api.pepy.tech/api/v2/projects/voicepad",
    "fetched_at": "2026-06-28T04:05:43.596403Z",
    "package_version": [
      "0.1.1",
      "0.1.2",
      "0.1.3",
      "0.1.4",
      "0.1.5",
      "0.1.6",
      "0.1.7",
      "0.1.8",
      "0.1.9",
      "0.1.10",
      "0.2.0",
      "0.2.1"
    ],
    "provider": "pepy"
  }
}
